{
  "_warning": "SYNTHETIC TEST FIXTURE — NOT REAL FINANCIAL DATA. Auto-generated by scripts/synth_generator.py for edge-case testing. Do not cite, do not use for production scoring, do not share externally.",
  "synthetic_fixture": true,
  "synthetic_id": "SYNTH_CONFLICTING_DISCLOSURES",
  "case_id": "conflicting_disclosures",
  "sector": "any",
  "induced_issues": [
    "disclosure_1_says_X",
    "disclosure_2_says_Y_on_same_metric"
  ],
  "financial_statements": {
    "income_statement": {
      "fy2025": {
        "revenue": 150309,
        "ebitda": 30000,
        "net_income": 18000
      }
    },
    "balance_sheet": {
      "fy2025": {
        "total_assets": 400000,
        "total_equity": 180000,
        "net_debt": 60000
      }
    },
    "cash_flow": {
      "fy2025": {
        "cfo": 24000,
        "depreciation": 10000
      }
    }
  },
  "disclosures": [
    {
      "disclosure_id": "DISC_001",
      "topic": "annual_revenue_main_section",
      "text": "Yıllık gelir 150,309 TL olarak rapor edilmiştir."
    },
    {
      "disclosure_id": "DISC_002",
      "topic": "annual_revenue_management_letter",
      "text": "Yönetim mektubunda yıllık gelir 175,309 TL olarak belirtilmiştir.",
      "intentionally_conflicting_with": "DISC_001"
    }
  ],
  "expected_agent_behavior": {
    "should_flag": [
      "critical_contradiction_between_disclosures"
    ],
    "should_not_silently_pass": [
      "critical_contradiction_between_disclosures"
    ],
    "expected_contradiction_severity": "critical"
  },
  "generator": {
    "script_version": "1.0.0",
    "seed": 42,
    "generated_at": "2026-04-28T09:50:44.075902Z"
  }
}
