{
  "_warning": "SYNTHETIC TEST FIXTURE — NOT REAL FINANCIAL DATA. Auto-generated by scripts/synth_generator.py for edge-case testing. Do not cite, do not use for production scoring, do not share externally.",
  "synthetic_fixture": true,
  "synthetic_id": "SYNTH_BANK_NIM_JUMP",
  "case_id": "bank_nim_jump",
  "sector": "banking",
  "induced_issues": [
    "nim_yoy_doubled",
    "unexplained_trading_gain"
  ],
  "financial_statements": {
    "income_statement": {
      "fy2024": {
        "net_interest_income": 40000,
        "trading_gain": 2000,
        "net_income": 25000
      },
      "fy2025": {
        "net_interest_income": 80000,
        "trading_gain": 15127,
        "net_income": 50000
      }
    },
    "balance_sheet": {
      "fy2025": {
        "total_assets": 1000000,
        "loans": 700000,
        "deposits": 800000
      }
    },
    "cash_flow": {
      "fy2025": {
        "cfo": 60000
      }
    },
    "ratios": {
      "nim_fy2024": 0.04,
      "nim_fy2025": 0.08
    }
  },
  "disclosures": [
    {
      "disclosure_id": "DISC_001",
      "topic": "nim_increase",
      "text": "Net faiz marjı 2025'te 2024'e göre belirgin artış göstermiştir; metodoloji açıklaması paylaşılmamıştır."
    }
  ],
  "expected_agent_behavior": {
    "should_flag": [
      "nim_jump_yoy",
      "trading_gain_unexplained"
    ],
    "should_not_silently_pass": [
      "nim_jump_yoy"
    ],
    "expected_contradiction_severity": "material"
  },
  "generator": {
    "script_version": "1.0.0",
    "seed": 42,
    "generated_at": "2026-04-28T09:50:44.075902Z"
  }
}
