{
  "_warning": "SYNTHETIC TEST FIXTURE — NOT REAL FINANCIAL DATA. Auto-generated by scripts/synth_generator.py for edge-case testing. Do not cite, do not use for production scoring, do not share externally.",
  "synthetic_fixture": true,
  "synthetic_id": "SYNTH_HIGH_LEVERAGE_LIQUIDITY_STRESS",
  "case_id": "high_leverage_liquidity_stress",
  "sector": "industrial",
  "induced_issues": [
    "net_debt_to_ebitda_above_5",
    "current_ratio_below_1"
  ],
  "financial_statements": {
    "income_statement": {
      "fy2025": {
        "revenue": 250000,
        "ebitda": 50000,
        "net_income": 5000
      }
    },
    "balance_sheet": {
      "fy2025": {
        "total_assets": 500000,
        "total_equity": 60000,
        "net_debt": 300619,
        "current_assets": 80000,
        "current_liabilities": 100000
      }
    },
    "cash_flow": {
      "fy2025": {
        "cfo": 10000,
        "depreciation": 25000
      }
    },
    "ratios": {
      "net_debt_to_ebitda_fy2025": 6.01,
      "current_ratio_fy2025": 0.8
    }
  },
  "disclosures": [
    {
      "disclosure_id": "DISC_001",
      "topic": "leverage_disclosure",
      "text": "Net borç / FAVÖK çarpanı ~6.01x; cari oran ~0.80x. Yönetim refinansman planı henüz açıklanmadı."
    }
  ],
  "expected_agent_behavior": {
    "should_flag": [
      "leverage_distress",
      "liquidity_distress",
      "p0_chairman_question"
    ],
    "should_not_silently_pass": [
      "leverage_distress",
      "liquidity_distress"
    ],
    "expected_contradiction_severity": "material"
  },
  "generator": {
    "script_version": "1.0.0",
    "seed": 42,
    "generated_at": "2026-04-28T09:50:44.076902Z"
  }
}
