{
  "_warning": "SYNTHETIC TEST FIXTURE — NOT REAL FINANCIAL DATA. Auto-generated by scripts/synth_generator.py for edge-case testing. Do not cite, do not use for production scoring, do not share externally.",
  "synthetic_fixture": true,
  "synthetic_id": "SYNTH_MISSING_CRITICAL_METRIC",
  "case_id": "missing_critical_metric",
  "sector": "industrial",
  "induced_issues": [
    "revenue_present_ebitda_missing",
    "coverage_gap_critical"
  ],
  "financial_statements": {
    "income_statement": {
      "fy2025": {
        "revenue": 100619,
        "ebitda": null,
        "net_income": null
      }
    },
    "balance_sheet": {
      "fy2025": {
        "total_assets": 350000,
        "total_equity": 150000
      }
    },
    "cash_flow": {
      "fy2025": {
        "cfo": 20000
      }
    }
  },
  "disclosures": [
    {
      "disclosure_id": "DISC_001",
      "topic": "ebitda_omission",
      "text": "FAVÖK satırı bu raporda açıklanmamıştır; analist bu durumda kapsam boşluğu işaretlemelidir."
    }
  ],
  "expected_agent_behavior": {
    "should_flag": [
      "missing_ebitda",
      "coverage_gap_at_critical_stem"
    ],
    "should_not_silently_pass": [
      "missing_ebitda"
    ],
    "expected_contradiction_severity": "material"
  },
  "generator": {
    "script_version": "1.0.0",
    "seed": 42,
    "generated_at": "2026-04-28T09:50:44.076902Z"
  }
}
