{
  "_warning": "SYNTHETIC TEST FIXTURE — NOT REAL FINANCIAL DATA. Auto-generated by scripts/synth_generator.py for edge-case testing. Do not cite, do not use for production scoring, do not share externally.",
  "synthetic_fixture": true,
  "synthetic_id": "SYNTH_EXPORTER_FX_SHOCK",
  "case_id": "exporter_fx_shock",
  "sector": "industrial",
  "induced_issues": [
    "fx_translation_gain_40pct",
    "export_revenue_down_despite_try_weakness"
  ],
  "financial_statements": {
    "income_statement": {
      "fy2025": {
        "revenue": 600000,
        "export_revenue": 200000,
        "fx_translation_gain": 40123,
        "net_income": 100309
      }
    },
    "balance_sheet": {
      "fy2025": {
        "total_assets": 800000,
        "total_equity": 300000,
        "net_debt": 200000
      }
    },
    "cash_flow": {
      "fy2025": {
        "cfo": 70000,
        "depreciation": 30000
      }
    },
    "ratios": {
      "export_revenue_yoy_pct": -0.15
    }
  },
  "disclosures": [
    {
      "disclosure_id": "DISC_001",
      "topic": "fx_exposure",
      "text": "FX çevrim kazancı net dönem karının yaklaşık %40'ını oluşturmaktadır (~40,123 TL). İhracat geliri TL zayıflığına rağmen %15 azaldı."
    }
  ],
  "expected_agent_behavior": {
    "should_flag": [
      "fx_dominated_earnings",
      "export_revenue_inconsistency_with_fx"
    ],
    "should_not_silently_pass": [
      "fx_dominated_earnings"
    ],
    "expected_contradiction_severity": "material"
  },
  "generator": {
    "script_version": "1.0.0",
    "seed": 42,
    "generated_at": "2026-04-28T09:50:44.075902Z"
  }
}
