{
  "_warning": "SYNTHETIC TEST FIXTURE — NOT REAL FINANCIAL DATA. Auto-generated by scripts/synth_generator.py for edge-case testing. Do not cite, do not use for production scoring, do not share externally.",
  "synthetic_fixture": true,
  "synthetic_id": "SYNTH_HOLDING_WITH_SEGMENT_CONFLICT",
  "case_id": "holding_with_segment_conflict",
  "sector": "holding",
  "induced_issues": [
    "parent_consolidated_mismatch",
    "segment_total_mismatch"
  ],
  "financial_statements": {
    "income_statement": {
      "fy2025": {
        "revenue": 100619,
        "ebitda": 25000,
        "net_income": 12000
      }
    },
    "balance_sheet": {
      "fy2025": {
        "total_assets": 500000,
        "total_equity": 200000,
        "net_debt": 80000
      }
    },
    "cash_flow": {
      "fy2025": {
        "cfo": 18000,
        "depreciation": 5000
      }
    },
    "segment_breakdown": {
      "fy2025": [
        {
          "segment": "energy",
          "revenue": 29614,
          "operating_income": 9000
        },
        {
          "segment": "industrial",
          "revenue": 49525,
          "operating_income": 8000
        }
      ]
    }
  },
  "disclosures": [
    {
      "disclosure_id": "DISC_001",
      "topic": "segment_reporting",
      "text": "Segment toplamı (~79,139 TL) konsolide gelirden (~100,619 TL) düşüktür; eliminasyon notu eksiktir."
    }
  ],
  "expected_agent_behavior": {
    "should_flag": [
      "segment_total_mismatch",
      "missing_elimination_note"
    ],
    "should_not_silently_pass": [
      "segment_total_mismatch"
    ],
    "expected_contradiction_severity": "material"
  },
  "generator": {
    "script_version": "1.0.0",
    "seed": 42,
    "generated_at": "2026-04-28T09:50:44.073902Z"
  }
}
