{
  "_warning": "SYNTHETIC TEST FIXTURE — NOT REAL FINANCIAL DATA. Auto-generated by scripts/synth_generator.py for edge-case testing. Do not cite, do not use for production scoring, do not share externally.",
  "synthetic_fixture": true,
  "synthetic_id": "SYNTH_AIRLINE_MISSING_DA",
  "case_id": "airline_missing_da",
  "sector": "aviation",
  "induced_issues": [
    "depreciation_null_in_cf",
    "ebitda_lower_than_ebit"
  ],
  "financial_statements": {
    "income_statement": {
      "fy2025": {
        "revenue": 202238,
        "ebit": 15000,
        "ebitda": 12000,
        "net_income": 8000
      }
    },
    "cash_flow": {
      "fy2025": {
        "cfo": 10000,
        "depreciation": null,
        "capex": -25000
      }
    },
    "balance_sheet": {
      "fy2025": {
        "total_assets": 350000,
        "fleet_value": 250000,
        "net_debt": 180000
      }
    }
  },
  "disclosures": [
    {
      "disclosure_id": "DISC_001",
      "topic": "fleet_depreciation",
      "text": "Filo amortismanı dipnot 18'de açıklanmıştır; ancak nakit akış tablosunda satır boş bırakılmıştır."
    }
  ],
  "expected_agent_behavior": {
    "should_flag": [
      "ebitda_lower_than_ebit_inversion",
      "cf_depreciation_null"
    ],
    "should_not_silently_pass": [
      "ebitda_lower_than_ebit_inversion"
    ],
    "expected_contradiction_severity": "critical"
  },
  "generator": {
    "script_version": "1.0.0",
    "seed": 42,
    "generated_at": "2026-04-28T09:50:44.074903Z"
  }
}
