{
  "_warning": "SYNTHETIC TEST FIXTURE — NOT REAL FINANCIAL DATA. Auto-generated by scripts/synth_generator.py for edge-case testing. Do not cite, do not use for production scoring, do not share externally.",
  "synthetic_fixture": true,
  "synthetic_id": "SYNTH_STEEL_IAS29_ANOMALY",
  "case_id": "steel_ias29_anomaly",
  "sector": "steel",
  "induced_issues": [
    "monetary_gain_50pct_of_ni",
    "operating_margin_anomaly"
  ],
  "financial_statements": {
    "income_statement": {
      "fy2025": {
        "revenue": 80000,
        "operating_profit": 5000,
        "monetary_gain": 10077,
        "net_income": 20154
      }
    },
    "balance_sheet": {
      "fy2025": {
        "total_assets": 200000,
        "total_equity": 90000,
        "net_debt": 50000
      }
    },
    "cash_flow": {
      "fy2025": {
        "cfo": 6000,
        "depreciation": 8000
      }
    }
  },
  "disclosures": [
    {
      "disclosure_id": "DISC_001",
      "topic": "ias29_application",
      "text": "IAS-29 enflasyon muhasebesi uygulanmıştır; net dönem karının yaklaşık %50'si parasal kazançtan (10,077 TL) kaynaklanmaktadır."
    }
  ],
  "expected_agent_behavior": {
    "should_flag": [
      "ias29_monetary_gain_dominant",
      "low_operating_margin_high_NI"
    ],
    "should_not_silently_pass": [
      "ias29_monetary_gain_dominant"
    ],
    "expected_contradiction_severity": "material"
  },
  "generator": {
    "script_version": "1.0.0",
    "seed": 42,
    "generated_at": "2026-04-28T09:50:44.074903Z"
  }
}
